binding_id,role_id,allowed_agentjob_types,allowed_reads,allowed_writes,forbidden_actions,required_validators,completion_evidence,expiry_policy,authority_status,owner,supersedes,source_hash,last_validated_at,notes
bind_system_director,system_director,director_decision;agentjob_selection,PRDs/**;implementation_plans/**;sys-for-ai/control_records/**;sys-for-ai/registries/**,sys-for-ai/control_records/director_decisions/**;sys-for-ai/control_records/agentjobs/**;sys-for-ai/registries/**,execute multiple AgentJobs without transaction model,validate-control-loop;validate-registry-graph,decision record;handoff,registered role no expiry,controlled,system_director,,pending,pending,System Director execution binding seed.
bind_implementation_initialization_agent,implementation_initialization_agent,implementation_initialization,PRDs/**;implementation_plans/**;sys-for-ai/**,sys-for-ai/**,mutate generated derivative as canonical,make validate,completion receipt;handoff,registered role no expiry,controlled,system_director,,pending,pending,Implementation initialization execution binding seed.
bind_system_engineer,system_engineer,prd_integration;requirements_trace,PRDs/**;implementation_plans/**;sys-for-ai/registries/**,PRDs/**;sys-for-ai/registries/**,remove Phase 0 to Phase 1 boundary,validate-requirement-trace,trace rows;completion receipt,registered role no expiry,controlled,system_director,,pending,pending,System engineer compatibility binding seed.
bind_documentation_librarian,documentation_librarian,configuration_control;runtime_skill_reconciliation,PRDs/**;implementation_plans/**;sys-for-ai/registries/**;.agents/**,sys-for-ai/registries/**;sys-for-ai/docs/generated/**;.agents/**,treat generated derivatives as source authority,validate-generated-derivatives;validate-registry-graph,registry rows;generated derivative check,registered role no expiry,controlled,system_director,,pending,pending,Documentation librarian binding seed.
bind_user_wants_elicitor,user_wants_elicitor,discovery_gate,PRDs/**;sys-for-ai/templates/system_definition/**;.agents/skills/system-definition-interview-context-45/**,sys-for-ai/control_records/system_definition/**;sys-for-ai/registries/discovery_record_registry.csv,automatically create PRD or promote candidate requirements,validate-discovery-records,RDR path;validation status,registered role no expiry,controlled,system_director,,pending,pending,Discovery gate binding seed.
